J,"Matheson, B; Petersen, EJ","Matheson, Breeanne; Petersen, Emily January",,,The Profession of Technical Communication through the Lens of the STC India Chapter: Understanding Current Perspectives and Future Directions,TECHNICAL COMMUNICATION,,,,Article,,,,,,,,"Purpose: India's community of technical communicators has grown steadily since the 1990s; however, scholarly research contains little about the experiences and needs of this community. We aim to enrich existing literature by sharing questionnaire results that begin to establish the state of the field in India. We discuss the way practitioners associated with the STC India chapter professionalize through education and training and innovate by experimenting with new genres and technologies. Method: We administered an online questionnaire with 32 questions among participants at the STC India conference in Bangalore; 76 people responded. The questionnaire asked about participants' professional backgrounds, vision for the future of TPC, and educational experiences. Data from the questionnaire, both qualitative and quantitative, was anonymized, coded, and evaluated. Results: The data suggest that practitioners in this study view their most significant role as writing and have high levels of content knowledge and experience with cross-cultural collaboration. They are educated in the technical and scientific fields but see themselves as lacking opportunities for university degrees in technical communication. Participants were aware of the constantly changing nature of the economy and workplaces and articulated how technical communication in India may be affected. The data illuminated the potential for improved cross-cultural partnerships in research and industry. Conclusion: Practitioners in this study possess high levels of education and understand the importance of change in technical communication. They are working to adapt and stay relevant in a rapidly changing field. The data suggest that these practitioners are seeking additional technical communication-specific training. More research is needed to understand the state of technical communication in India more broadly.",,,,,,,,,,,22,0,0,,,,,,,,,,,AUG,2020,67,3,,,,,26,44,,,,,,,,,,,,,,,,,View Full Record in Web of Science
J,"Friess, E","Friess, Erin",,,Filling to Capacity: An Exploratory Study of Project Management Language in Agile Scrum Teams,TECHNICAL COMMUNICATION,,,,Article,,,,,,,,"Purpose: This exploratory study investigates the project management (PM) language used by Agile Scrum team members at a software development firm within their Scrum meetings. Method: The meetings from three sprints were audio-recorded and all spoken exchanges were transcribed. A codebook was developed to assess for meeting function PM language. A correspondence analysis assessed the association of Scrum meeting type and PM language. Results: The results of this exploratory study suggest that the Scrum team members use PM language in somewhat ritualized ways, particularly when some of the PM language is deployed. The correspondence analysis also suggests five associations between certain meeting types and certain PM language. Conclusion: This exploratory study provides a baseline of in situ Scrum-based project management upon which other studies may build, which may become useful as future studies may expand to include Kanban and Scrumban. It also suggests that while this Scrum-based group uses some PM language in expected ways (i.e., team maintenance is associated with kickoff meetings), other uses are unexpected (i.e., planning language is not associated with planning meetings). These differentiations from the ideal Scrum PM process suggest that future research is warranted.",,,,,,,,,,,37,8,8,,,,,,,,,,,MAY,2018,65,2,,,SI,,169,180,,,,,,,,,,,,,,,,,View Full Record in Web of Science
J,"Thielsch, MT; Wirth, M","Thielsch, Meinald T.; Wirth, Manuel",,,Web-Based Annual Reports at First Contact: Corporate Image and Aesthetics,TECHNICAL COMMUNICATION,,,,Article,,,,,,,,"Purpose: Enterprises aim for a favorable corporate image and use their corporate annual reports to impart it. The annual report is a formal document that fulfills the mandatory disclosure requirements and serves as an organization's mass communication medium to inform shareholders, investors, employees, customers, suppliers, and the press, as well as the general public. In particular, large enterprises provide an additional online version of their report. We investigated user engagement at first contact with such Web-based annual reports and the influence of main report characteristics-content, usability, and aesthetics-on corporate image and overall impressions. Method: In a Web-based study, 155 participants read one of eight online corporate annual reports from German companies. Corporate image was assessed before and after browsing the report, overall impression afterwards. The report characteristics content, usability, and aesthetics were measured with established and validated questionnaires. Results: Findings were in line with our hypotheses: Corporate image significantly improved from before to after reading a Web-based annual report, even as reading time was short, demonstrating a mere exposure effect. The report characteristics content, usability, and aesthetics explained 20.5% of the variation in this increase and 66.0% of the overall impression of the reports; the best predictor was visual aesthetics. Conclusion: Content features of corporate reports are often limited by legal requirements, and usability of online reports is mainly driven by users' demands. However, organizations can positively influence their public perception by improving the visual design of their annual reports online.",,,,,,,,,,,76,2,2,,,,,,,,,,,NOV,2017,64,4,,,,,282,296,,,,,,,,,,,,,,,,,View Full Record in Web of Science
J,"Hirst, R","Hirst, Russel",,,Stories from the Secret City: Ray Smith's Art of Narrative as Rhetoric,TECHNICAL COMMUNICATION,,,,Article,,,,,,,,"Purpose: To help readers better understand the craft and the rhetorical power of narrative as used in corporate and community settings-and to illustrate strategies that rhetorical storytellers may employ. Method: This article analyzes storytelling by means of a case study in the art of narrative as used in support of an organization, community, and industry. The organization is Y-12 National Security Complex, which makes parts for America's nuclear arsenal and does research and production in nuclear materials for medicine, biology, industry, and nuclear energy and propulsion. The community is Oak Ridge, Tennessee and environs. Industry references the nuclear industry in Oak Ridge and beyond, including its partnership with the U.S. military. The subject of the case study-the person whose narrative art is here analyzed-is Ray Smith, official historian of Y-12. The material analyzed comes from publications by Smith, notes from interviews with him on multiple occasions, and many sessions of listening to his stories both in person and via recordings (documentaries, presentations available on web sites, etc.). Results: This study finds that Smith's stories connected with the Manhattan Project, and the years preceding and succeeding it, constitute a model set of narratives displaying the rhetorical power of storytelling in an organizational setting. Conclusion: By studying the ways narrative is successfully used in professional settings, we deepen our understanding of rhetorical storytelling as well as our ability to use it. This skill has wide application to contexts of technical and professional communication. It can be used to elevate public opinion about a corporation, community, or industry; to breed confidence among consumers and investors; to construct leadership models for managers; to inspire and motivate employees-and in virtually any other sort of rhetorical enterprise.",,,,,,,,,,,21,1,1,,,,,,,,,,,FEB,2017,64,1,,,,,6,26,,,,,,,,,,,,,,,,,View Full Record in Web of Science
J,"Lauer, C; Brumberger, E","Lauer, Claire; Brumberger, Eva",,,Technical Communication as User Experience in a Broadening Industry Landscape,TECHNICAL COMMUNICATION,,,,Article,,,,,,,,"Purpose: Based on an analysis of 502 industry job postings, this article argues that technical communication work shares traits and competencies with the field of UX and that technical communicators who are not already doing UX work are well-qualified to expand their career paths into the UX field and could, in fact, play a central role in UX. Method: We analyzed 502 user experience job postings from Monster.com. After mining the postings for position title, job type, education level, experience level, location, salary, and industry sector, we conducted a content analysis of the job descriptions, using open coding to identify professional competencies and personal characteristics that employers are seeking in applicants, as well as key technologies and information products. Results: The user experience job postings could be grouped into five categories-Designer, Developer, Architect, Manager, Researcher-each with a distinct profile in terms of information products, technology skills, and professional competencies. However, the job postings also reflected skills, competencies, and characteristics that were common across job categories, and several of these are areas that overlap with more traditional technical communication positions. Conclusion: We articulate the advantages and challenges of transitioning into UX and make recommendations to help technical communication practitioners and programs capitalize on the advantages and address the challenges.",,,,,,,,,,,23,26,26,,,,,,,,,,,AUG,2016,63,3,,,,,248,264,,,,,,,,,,,,,,,,,View Full Record in Web of Science
J,"Lanier, CR","Lanier, Clinton R.",,,Accounting for the Human Element When Planning for a Content Management System,TECHNICAL COMMUNICATION,,,,Article,,,,,,,,"Purpose: This article assists technical communication professionals in planning, designing and implementing a content management system (CMS) in their organization. As my organization discovered, few resources exist explaining the considerations involved in such an initiative, and there was a noted lack of information to help us plan for human-based factors affecting its success. This article attempts to fill that gap by relating our experiences. Method: We first monitored the CMS to understand its use by our organization's authors. Next, we conducted a survey to understand their perceptions of the system. We then made changes to the system based on the answers gathered in the survey. Finally, we monitored the system's use once more after the changes were made. Results: Our study suggested that authors did not want to use the new system because they were insecure in using it, perceived it as too difficult to use, and were unfamiliar with the system (among other issues). We then implemented a more familiar interface, created a version control system allowing them to revert to previous versions if they made mistakes, and created and deployed Web-based video tutorials. Finally, we tracked a noted increase in the use of the system by our authors. Conclusion: Based on our experience, for future technical communicators considering a CMS, I suggest involving those affected as soon as possible, implementing tools that are familiar, providing multiple methods of training, and creating mechanisms to ease anxiety about mistakes and errors.",,,,,,,,,,,18,1,1,,,,,,,,,,,MAY,2012,59,2,,,,,99,111,,,,,,,,,,,,,,,,,View Full Record in Web of Science
J,"Cleary, Y","Cleary, Yvonne",,,Discussions About the Technical Communication Profession: Perspectives from the Blogosphere,TECHNICAL COMMUNICATION,,,,Article,,,,,,,,"Purpose: To examine how blogs reflect practitioner views of professionalization topics (such as education, professional societies, and value and status). Method: Content analysis of 10 practitioner blogs, focusing on professional topics of status, education, professional societies, and the effects of technology. Results: Although the bloggers under study appear to function as an effective community of practice, they are not currently directing their actions or attention toward the traditional goals of professionalization, such as licensing and accreditation. Conclusions: The latent themes that emerge show that many of the goals of professionalizing (such as standardizing routes into the field and increasing respect for the work) are also concerns of practitioners.",,,,,,,,,,,64,8,8,,,,,,,,,,,FEB,2012,59,1,,,,,8,28,,,,,,,,,,,,,,,,,View Full Record in Web of Science
J,"Eyman, D","Eyman, Douglas",,,Computer gaming and technical communication: An ecological framework,TECHNICAL COMMUNICATION,,,,Article,,,,,,,,Provides an overview of gaming definitions and genres Argues that games provide a rich area for research and theory building in technical communication Details a five-part framework for mapping game activity to technical communication interests.,,,,,,,,,,,37,21,21,,,,,,,,,,,AUG,2008,55,3,,,,,242,250,,,,,,,,,,,,,,,,,View Full Record in Web of Science
J,"Thomas, S; McShane, BJ","Thomas, Shelley; McShane, Becky Jo",,,Skills and Literacies for the 21(st) century: Assessing an undergraduate professional and technical writing program,TECHNICAL COMMUNICATION,,,,Article,,,,,,,,"Describes an assessment process for Professional and Technical Writing at Weber State University Includes a review of the literature, outcomes for each course, and a rubric to evaluate student portfolios in the capstone course.",,,,,,,,,,,0,7,7,,,,,,,,,,,NOV,2007,54,4,,,,,412,423,,,,,,,,,,,,,,,,,View Full Record in Web of Science
J,"O'Brien, AL; Walwema, J","O'Brien, April L.; Walwema, Josephine",,,Countering Dominant Narratives in Public Memory,TECHNICAL COMMUNICATION,,,,Article,,,,,,,,"Purpose: State historical commissions tend to avoid erecting historical marker texts (HMTs), memorials, or monuments that document violence towards Black and brown individuals. The Equal Justice Initiative (EJI) uses a series of tactics to circumvent local historical commissions to memorialize victims of lynching.Methods: In this study, we use the EJI's Community Remembrance Project (CRP), an informational handbook for community activists, as our data set. We apply the 4Rs (Walton, Moore, & Jones, 2019) and tactical technical communication in our analysis of the Community Remembrance Project and argue that the document functions as a coalitional, truth-telling tactic to redress inequalities in public memory. Results: We found that the EJI's CRP efforts with the Historical Marker Project clearly demonstrate how coalitions can tactically intervene in racist systems-like historical commissions that reject truth-telling efforts-by creating a different path for historical markers to be erected in communities.Conclusion: We argue that public memory texts often reinforce racism by avoiding topics like racial terror lynching and that these omissions have cultural and material consequences on communities. We contend that technical communicators can intervene in public memory systems and promote truth-telling through coalitional approaches to community activism.",,,,,,,,,,,51,2,2,,,,,,,,,,,AUG,2022,69,3,,,,,40,55,,10.55177/tc985417,http://dx.doi.org/10.55177/tc985417,,,,,,,,,,,,,,View Full Record in Web of Science
J,"Baniya, S; Chen, C","Baniya, Sweta; Chen, Chen",,,Experiencing a Global Pandemic: The Power of Public Storytelling as Antenarrative in Crisis Communication,TECHNICAL COMMUNICATION,,,,Article,,,,,,,,"Purpose: This article explores the role of storytelling in public spaces during the global pandemic. We explore how storytelling can be used as a powerful medium of communicating crisis and addressing injustices during the pandemic. Method: We conducted a rhetorical analysis of the digital stories, images, and podcasts from UnCoVer Initiative in China and Nepal PhotoProject in Nepal focusing on how these stories act as an antenarrative to the dominant pandemic narrative during a crisis. Results: We found that both platforms acted as transnational and transcultural coalitional spaces, revealing and rejecting injustices through critical and reflexive storytelling, building collective knowledge on navigating the crisis, and developing solidarity through identification. Conclusion: Storytelling can be used not only to communicate technical information about pandemics but also as a form of resistance to reveal, reject, and replace injustices that happen during a crisis.",,,,,,,,,,,62,0,0,,,,,,,,,,,NOV,2021,68,4,,,,,74,87,,,,,,,,,,,,,,,,,View Full Record in Web of Science
J,"Malone, EA; Roberson, EM","Malone, Edward A.; Roberson, Elizabeth M.",,,"The Mandative Subjunctive in Technical Writing, or the Gap Between Subconscious and Conscious Grammatical Knowledge",TECHNICAL COMMUNICATION,,,,Article,,,,,,,,"Purpose: In technical writing, the consistent use of the present subjunctive in mandative that-clauses can promote stylistic clarity by distinguishing the not-yet actualized from the already actualized. A grammar rule requires the use of the present subjunctive in such contexts. We tested a group of STEM majors at our university to see whether they were predisposed to use the present subjunctive in mandative that-clauses when they were composing new content or editing existing content. Methods: We administered two versions of a performance-based elicitation test in eight writing classes: (1) a complete-the-sentence version, in which the mandative that-clause lacked a complete predicate, and (2) a fill-in-the-blank version, in which the mandative that-clause lacked only a verb phrase (i.e., simple predicate). The former required composing new content, while the latter required editing existing content. Results: In the mandative that-clauses across both versions of the test, the present indicative was used in 51 percent of the responses, while the present subjunctive was used in 28 percent. The present subjunctive was used in 249 out of 720 responses (35 percent) on the complete-the-sentence version of the test, while it was used in 191 out of 828 responses (23 percent) on the fill-in-the-blank version. Conclusions: The students used the mandative subjunctive frequently, but they used the mandative indicative more frequently. They were more likely to use the mandative subjunctive when they were generating complete predicates (applying the grammar rule subconsciously in composing/drafting) than when they were supplying only simple predicates (applying the grammar rule consciously in editing/revising).",,,,,,,,,,,64,0,0,,,,,,,,,,,MAY,2021,68,2,,,,,61,86,,,,,,,,,,,,,,,,,View Full Record in Web of Science
J,"Conway, M; Oppegaard, B; Hayes, T","Conway, Megan; Oppegaard, Brett; Hayes, Tuyet",,,Audio Description: Making Useful Maps for Blind and Visually Impaired People,TECHNICAL COMMUNICATION,,,,Article,,,,,,,,"Purpose: Technical communicators concerned with such issues as media accessibility, disability rights, and universal design could explore fertile scholarly ground by investigating Audio Description more through applied research methods. This article illustrates such potential through the explication of a transmodal-translation process conducted on National Park Service brochures, including interpretation and transformation of their maps into acoustic forms. Method: Our mixed-methods approach included feedback from diverse blind, visually impaired, and sighted stakeholders, including administrators, media designers, and representative park-site users. These insights were then tested through field work and complemented by multiple interviews and focus groups. During this process, we developed digital tools-including open-source software and free mobile apps-for iterative testing and sharing of ideas. Results: Besides generating thematic and diverse insights about this topic, our study also established, developed, and refined a set of best-practices guidelines based on research in the field, informed by gathered empirical evidence. These guidelines are intended to support subject-matter experts at public attractions, regardless of discipline, in the creation of better, more accessible maps through Audio Description. Conclusion: How could a person possibly transform a complex, fully visual, and printed-on-paper map into useful acoustic media for blind and visually impaired visitors? After consulting the scattered, related literature, we oriented our efforts toward the multi-faceted technical communication practice of localization. We then dedicated our project resources to real-world interventions through both the application and the development of audio-description strategies and digital-media-delivery systems as a practical and universal approach to these related translation and localization problems.",,,,,,,,,,,31,2,2,,,,,,,,,,,MAY,2020,67,2,,,,,68,85,,,,,,,,,,,,,,,,,View Full Record in Web of Science
J,"van der Meij, H","van der Meij, Hans",,,Cognitive and Motivational Effects of Practice with Videos for Software Training,TECHNICAL COMMUNICATION,,,,Article,,,,,,,,"Purpose: Software makers nowadays regularly post videos on their websites to satisfy their clients' need for instructional support. Some of these designs include an opportunity for practice. This study investigated whether the presence and timing of practice affected motivation and learning in video-based software training. Method: An experiment is reported with four conditions: video-practice (VP), practice-video (PV), practice-video-practice (PVP), and video only (V). For motivation, the study assessed mood states and flow experience during training. In addition, task relevance and self-efficacy were measured before and after training. Learning was assessed with several performance tests for trained tasks. In addition, a transfer test was administered. Results: The findings for presence of practice were mixed. Practice increased training time and led to more negative mood states during training. A clear advantage of practice was found only on the transfer test. The findings for timing of practice favored a sequence in which instruction preceded practice. Perplexing results were found for the PVP condition. The highest learning gains were expected for this condition, but, instead, this condition had the lowest performance scores on a practice test and immediate post-test. Conclusion: This study indicates that the design issue of whether or not to complement video-based software training with practice is more complex than it seems.",,,,,,,,,,,45,8,8,,,,,,,,,,,AUG,2018,65,3,,,,,265,279,,,,,,,,,,,,,,,,,View Full Record in Web of Science
J,"Tham, JCK","Tham, Jason Chew Kit",,,"Interactivity in an Age of Immersive Media: Seven Dimensions for Wearable Technology, Internet of Things, and Technical Communication",TECHNICAL COMMUNICATION,,,,Article,,,,,,,,"Purpose: Interactivity in virtual environments has been a key area of investigation in fields ranging from technical to creative sectors. Scholars find a cross-disciplinary disparity on what interactivity embodies and accomplishes. This article traces the definitions of interactivity in existing research, devises seven dimensions of interactivity for wearables and IoT products, and identifies key roles for technical communicators in immersive media design. Method: A research review of key literature on interactivity in general and technical communication and mobile technologies in particular. Results: Current literature shows that concepts of interactivity in communication design and technology are multifaceted. Seven dimensions of interactivity can be derived for immersive media design: 1) reciprocity/ease of response, 2) synchronicity/context awareness, 3) connectedness/ubiquity/pervasiveness, 4) navigability/accessibility, 5) user control/personalization, 6) entertainment/sensibility, and 7) sensory stimulation/multimodality. These dimensions can be mapped onto the interactive design of wearables and IoT products. They also inform the roles of technical communicators in producing immersive technical communication. Conclusion: Further investigation of the constructs in interactivity can help uncover a more accurate relationship between interactivity and its dependent variables. The new dimensions of interactivity in immersive media environments suggest that technical communicators and designers must pay attention to 1) the seamless connection between the user and the systems, data, and actions; 2) user control and customization; 3) proactive contextual assistance from smart technologies; and 4) device sensibility and sensory stimulations.",,,,,,,,,,,87,11,11,,,,,,,,,,,FEB,2018,65,1,,,,,46,65,,,,,,,,,,,,,,,,,View Full Record in Web of Science
