Publication Type,Authors,Author Full Names,Book Author Full Names,Group Authors,Article Title,Source Title,Book Series Title,Book Series Subtitle,Language,Document Type,Conference Title,Conference Date,Conference Location,Conference Sponsor,Conference Host,Author Keywords,Keywords Plus,Abstract,Addresses,Affiliations,Reprint Addresses,Email Addresses,Researcher Ids,ORCIDs,Funding Orgs,Funding Name Preferred,Funding Text,Cited References,Cited Reference Count,"Times Cited, WoS Core","Times Cited, All Databases",180 Day Usage Count,Since 2013 Usage Count,Publisher,Publisher City,Publisher Address,ISSN,eISSN,ISBN,Journal Abbreviation,Journal ISO Abbreviation,Publication Date,Publication Year,Volume,Issue,Part Number,Supplement,Special Issue,Meeting Abstract,Start Page,End Page,Article Number,DOI,DOI Link,Book DOI,Early Access Date,Number of Pages,WoS Categories,Web of Science Index,Research Areas,IDS Number,Pubmed Id,Open Access Designations,Highly Cited Status,Hot Paper Status,Date of Export,UT (Unique WOS ID),Web of Science Record
J,"Britt, BC; Britt, RK","Britt, Brian C.; Britt, Rebecca K.",,,The Roles of Medium and Narrative Believability in Guided Mobile Tour Navigation,TECHNICAL COMMUNICATION,,,,Article,,,,,,,,"Purpose: This study investigates the role of need for cognition and narrative believability when using a mobile device to take a guided tour of a new location, informing future research and practice in both narrative design and media ecology. Method: Experiment participants (n = 141) toured a new research facility using one of three combinations of navigation aids (a smartphone only, a brochure and a smartphone, or a brochure only) as a guide. An ordinal regression analysis and multivariate regression analysis were used to assess the relationships among navigation aids, narrative believability, need for cognition, and perceived ease of navigation. Results: Use of a smartphone only or a brochure in tandem with a smartphone were positively related to evaluations of the narrative as highly consistent as well as perceptions that the narrative offered a high degree of coverage. However, using a brochure in tandem with a smartphone was negatively related to perceived ease of navigation, while narrative plausibility had a positive effect on perceived ease of navigation. Conclusion: This study illustrates how different mobile devices result in a range of interpretations of the same materials and, ultimately, different levels of success in real -world navigation. Even a simple narrative can aid wayfinding if users find it sufficiently plausible. More broadly, the results suggest the need for research to facilitate the development of more engaging multimedia tour guides.",,,,,,,,,,,82,1,1,,,,,,,,,,,AUG,2021,68,3,,,,,76,96,,,,,,,,,,,,,,,,,View Full Record in Web of Science
J,"Davis, C","Davis, Carleigh",,,Memetic Variation in The Whole30: Understanding Content Consistency in a Transmediated Nutritional Program,TECHNICAL COMMUNICATION,,,,Article,,,,,,,,"Purpose: The goal of this article is to understand how and why content relating to a popular nutrition program, the Whole30, is taken up or discarded when shifting between producer- and participant-controlled media. Method: This article utilizes memetic rhetorical analysis to identify interface- and content-specific memes and to explore the connections between those memes that create environments to which some adapt successfully while other are lost. Results: My analysis shows that the interface memes that characterize the Whole30 Facebook Community page create a communicative situation in which personal experience is more likely to be persuasive than scientific research or institutionally conferred credentials. Conclusion: Technical communicators need to craft technical and scientific content to allow for transmediated community interaction that draws on the affordances of social media sites to maintain the integrity of information.",,,,,,,,,,,24,0,0,,,,,,,,,,,AUG,2019,66,3,,,,,272,283,,,,,,,,,,,,,,,,,View Full Record in Web of Science
J,"Colton, JS; Edenfield, AC; Holmes, S","Colton, Jared S.; Edenfield, Avery C.; Holmes, Steve",,,Workplace Democracy and the Problem of Equality,TECHNICAL COMMUNICATION,,,,Article,,,,,,,,"Purpose: Professional communicators are becoming more invested in unique configurations of power in organizations, including non-hierarchical and democratic workplaces. While organizations dedicated to democratic processes may enact power differently than conventional organizations, they may fall short of practicing equality. This article explains the differences in non-hierarchical workplaces, considers businesses where democracy is a goal, and argues for considering equality as a habitual practice, particularly when writing regulatory documents. Method: We conduct a review of the literature on non-hierarchical workplaces and organizational democracy, applying Jacques Ranciere's concept of equality to two examples (one using primary data collection and one using secondary data) of two cooperatives where organizational democracy is integral to the design of the business. Results: The literature review exposes an interest in metis (cunning, craftiness, flexibility) as vital to practitioner success in non-hierarchical workplaces; however, this article demonstrates that metis does not prevent inequality, even in organizations expressly committed to workplace democracy. Conclusion: Professional communicators need to consider equality not solely as a structural resource (as in rules, laws, policies) but as a habitual practice to cultivate alongside other characteristics and frameworks important to a professional communicator's toolkit.",,,,,,,,,,,73,4,4,,,,,,,,,,,FEB,2019,66,1,,,,,53,67,,,,,,,,,,,,,,,,,View Full Record in Web of Science
J,"Chong, F","Chong, Felicia",,,YouTube Beauty Tutorials as Technical Communication,TECHNICAL COMMUNICATION,,,,Article,,,,,,,,"Purpose: With the increasing popularity of YouTube beauty videos, this study extends previous research on YouTube instructional videos by investigating the common characteristics of the 10 most-reviewed makeup and hair tutorials to determine their similarity to or differences from good instructional videos. Method: Using a deductive coding method, I analyzed the 10 most-viewed beauty tutorials based on Swarts' (2012) best practices for creating instructional videos and Mackiewicz's (2010) assertion categories of expertise. Results: A majority of the videos followed best practices, such as including an introduction, beginning with a promise or a clear objective, incorporating verbal instruction, being strategically redundant, and using a combination of text annotations, audio, and/or still images to complement the video. However, a lack of confidence and quality in most of the videos suggest that the creators did not rehearse their scripts, nor did they use the recording and editing tools effectively. None of the creators seems to provide any reassurance to the viewers or promote a sense of their self-efficacy. In terms of asserting their credibility, the majority of the creators did not make any explicit assertions about their relevant role, product-specific experience, or familiarity with related and relevant products. Conclusion: Although best practices, such as having a clear objective and using verbal instructions, should be followed, instructional video designers should also consider additional factors, such as truthfulness and accuracy, accessibility, kairos, addressivity, personal narratives, and humor.",,,,,,,,,,,46,10,10,,,,,,,,,,,AUG,2018,65,3,,,,,293,308,,,,,,,,,,,,,,,,,View Full Record in Web of Science
J,"Boettger, RK","Boettger, Ryan K.",,,The Technical Communication Editing Test: Three Studies on This Assessment Type,TECHNICAL COMMUNICATION,,,,Article,,,,,,,,"Purpose: In this paper, I present the results of three studies on editing tests used to screen prospective technical communicators and the error types common to these tests. Because few publically available, authentic examples exist, I first explore the general characteristics of 55 tests and 71 error types. Error types are correlated against 176 professionals' perceptions of these error types. Method: The sample's characteristics were first identified from the tests and the hiring managers. Three raters then independently classified the errors types using coding schemas from previous taxonomies of college-level writing. Finally, a 24-question survey was administered to capture professional communicators' perceptions of error. Results: Editing tests were typically designed in narrative format and evaluated holistically, but variation in administration and format existed. The sample included 3,568 errors and 71 error types. Errors related to wrong words, spelling, and capitalization dominated, but 13 other errors were frequently found as well as dispersed within at least 50% of the sample. Conversely, professionals were bothered most by apostrophe errors, homonyms, and sentence fragments. No significant correlations were found among the frequencies and dispersions of the editing tests' errors and the professionals' perceptions of those errors. Conclusions: Editing tests share common characteristics, but organizational context substantially influences its format and contents. There were consistencies between the editing test error types and types identified in college-writing taxonomies; however, context again influences why errors are introduced as well as the types of errors that were identified. Finally, hiring managers and professionals share different perceptions of error. Understanding these differences can produce better assessment tools and better prepare test takers.",,,,,,,,,,,30,4,4,,,,,,,,,,,NOV,2014,61,4,,,,,215,231,,,,,,,,,,,,,,,,,View Full Record in Web of Science
J,"Coppola, NW","Coppola, Nancy W.",,,Professionalization of Technical Communication: Zeitgeist for Our Age Introduction to This Special Issue (Part 2),TECHNICAL COMMUNICATION,,,,Article,,,,,,,,"Purpose: To trace the contemporary currents of professionalization for technical communication and their impact on us. Methods: Analysis of literature, including social media, and conversations with our thought leaders. Results: A third aspect of establishing professional identity is described: emerging technological, sociocultural, and political currents. The ideological and economic processes were addressed in Technical Communication 58, 2011. Conclusions: Technical communicators are emerging as active players in today's dynamic enterprise with integrated skill sets to navigate rapidly changing work structures. Roadblocks are still present.",,,,,,,,,,,28,11,11,,,,,,,,,,,FEB,2012,59,1,,,,,1,7,,,,,,,,,,,,,,,,,View Full Record in Web of Science
J,"Hallier, PA; Malone, EA","Hallier, Patricia A.; Malone, Edward A.",,,Light's Technical Writing and Professional Status: Fifty Years Later,TECHNICAL COMMUNICATION,,,,Article,,,,,,,,"Purpose: To present a significant historical document in the decades-long movement to professionalize technical communication Methods: Historical analysis and textual editing Results: Light's 1961 article applied then-current definitions of a profession to technical writing and suggested that technical writers could become professionals only through formal education and training. Conclusions: On the 50th anniversary of its publication, Light's article illustrates the tenor of discussions about professionalization in the early years of our profession and invites comparison with current professionalization discussions.",,,,,,,,,,,12,0,0,,,,,,,,,,,NOV,2011,58,4,,,,,11,13,,,,,,,,,,,,,,,,,View Full Record in Web of Science
J,"Carnegie, TAM","Carnegie, Teena A. M.",,,Integrating context into assessing US technical communication programs,TECHNICAL COMMUNICATION,,,,Article,,,,,,,,Reviews the primary purposes for program reviews Outlines the four standard models Proposes the creation of a contextual program review model.,,,,,,,,,,,20,2,2,,,,,,,,,,,NOV,2007,54,4,,,,,447,458,,,,,,,,,,,,,,,,,View Full Record in Web of Science
J,"Loorbach, N; Karreman, J; Steehouder, M","Loorbach, Nicole; Karreman, Joyce; Steehouder, Michael",,,Adding motivational elements to an instruction manual for seniors: Effects on usability and motivation,TECHNICAL COMMUNICATION,,,,Article,,,,,,,,Tested versions of a manual intended to increase usability and motivation Found no statistically significant differences for user satisfaction or self-reported motivation Found that users of the experimental versions performed more tasks correctly.,,,,,,,,,,,27,19,19,,,,,,,,,,,AUG,2007,54,3,,,,,343,358,,,,,,,,,,,,,,,,,View Full Record in Web of Science
J,"Salvo, M; Zoetewey, MW; Agena, K","Salvo, Michael; Zoetewey, Meredith W.; Agena, Kate",,,A case of exhaustive documentation: Re-centering system-oriented organizations around user need,TECHNICAL COMMUNICATION,,,,Article,,,,,,,,"Demonstrates a shift from establishing documentation procedures to critically, assessing and reforming existing procedures Concludes with an inventory for determining whether other organizations are overdocumenting processes and products.",,,,,,,,,,,24,3,3,,,,,,,,,,,FEB,2007,54,1,,,,,46,57,,,,,,,,,,,,,,,,,View Full Record in Web of Science
J,"Moore, KR; Jones, NN; Walton, R","Moore, Kristen R.; Jones, Natasha N.; Walton, Rebecca",,,Contextualizing the 4Rs Heuristic with Participant Stories,TECHNICAL COMMUNICATION,,,,Article,,,,,,,,"Purpose: This article explores the strategies technical and professional communicators use in addressing issues of social injustice in their daily lives, including academic workplaces and communities. In embracing a storytelling approach and Black Feminist epistemology, we explore the limits of traditional heuristics, illustrating the need to couple storytelling and lived experience with heuristic frameworks. Method: This study employs a qualitative, narrative inquiry methodology and semi structured interview data collection approaches. Results: Two elements of Walton, Moore, and Jones' (2019) 4Rs heuristic were expanded upon and further articulated through participant stories. To help people develop the ability to recognize injustice, data identified three sources for building expertise: lived experience, reading and proximity to lived experience, and accumulation within and across experiences. Revealing injustices occurred through both planned, often written, responses and in-the-moment responses. Conclusion: Stories and lived experience can augment our understanding of how heuristics work in context and provide a source of critical imagination for those attempting to use heuristics.",,,,,,,,,,,72,3,3,,,,,,,,,,,NOV,2021,68,4,,,,,8,25,,,,,,,,,,,,,,,,,View Full Record in Web of Science
J,"McCool, LB","McCool, Lynn B.",,,Next-Gen Resumes: A Case Study of Using Transmedia Storytelling to Create Personal Branding on LinkedIn,TECHNICAL COMMUNICATION,,,,Article,,,,,,,,"Purpose: The focus of this article is to examine how professionals may be adapting the once-stable resume genre to a next-generation (next-gen) iteration of this genre by using multiple media to create and sustain personal branding. Method: Using a qualitative case study methodology, this research examined Linkedln's public user profiles. One case study participant was selected, whose profile met the criteria of promoting personal branding via multiple media artifacts, using transmedia storytelling techniques, and networking inside a participatory social media culture. Results: In this case study, the participant, Jacobs, used multimodal composing and transmedia storytelling techniques on Linkedln's social media site. Sharing smaller narratives across different media, Jacobs invites participation from his followers as well as responses from him to his followers. Within this participatory culture, his posts often blur personal and professional topics of interest but still remain singularly focused on promoting his personal branding to a wider audience Conclusion: Young professionals are not turning to traditional resources for advice on how to establish personal branding. Instead, they are turning to a networked, social world and using multiple media and transmedia storytelling techniques to attract followers, connect to other professionals, and network with potential employers.",,,,,,,,,,,34,3,3,,,,,,,,,,,AUG,2019,66,3,,,,,230,243,,,,,,,,,,,,,,,,,View Full Record in Web of Science
J,"Mueller, D","Mueller, David",,,The Transmedia Workbench: Technical Communication and User-Driven Innovation,TECHNICAL COMMUNICATION,,,,Article,,,,,,,,"Purpose: Emergent cultural and technological developments are actively involving users not just in how technology is understood and utilized but also in how it is produced and what its capabilities might be. From the perspective of technical communication, this direct involvement is enacted across networks of participatory media artifacts: webpages, user forums, tutorial videos, images, and open source software. In this article, I discuss how these transmedia networks support user-driven innovation and what roles technical communicators might play in creating, curating, and maintaining them. As a case study of a transmedia network, I examine the Werkstatt Workshop, the online user portal supporting Moog's Werkstatt synthesizer. Method: My case study employs discourse analytic techniques to show how the language of the Werkstatt Workshop is both descriptive and constitutive of an emergent social practice. To theorize roles for technical communicators, I draw on previous studies of user forums, open source software, and tactical technical communication. Results: Discourses circulating within the Werkstatt Workshop go beyond simply documenting system processes to construct a world in which network participants enact identities, form relationships, and reconfigure information across media boundaries. The open, participatory orientation of the network incentivizes information sharing and innovation, as users organize knowledge resources around a common set of technological problems. Conclusion: Emerging cultures of making and modifying present opportunities to technical communicators as content creators, network administrators, and critics, helping to construct, optimize, and seriously understand new, productive knowledge networks supporting user-centered production and innovation.",,,,,,,,,,,21,0,0,,,,,,,,,,,AUG,2019,66,3,,,,,244,256,,,,,,,,,,,,,,,,,View Full Record in Web of Science
J,"Evia, C; Priestley, M","Evia, Carlos; Priestley, Michael",,,Structured Authoring without XML: Evaluating Lightweight DITA for Technical Documentation,TECHNICAL COMMUNICATION,,,,Article,,,,,,,,"Purpose: We present a proposal for HDITA, an HTML5-based version of the Darwin Information Typing Architecture (DITA). We report on an exploratory study about the feasibility of using HDITA as an authoring platform for technical content. We asked how novice technical writers describe and evaluate the complexity and difficulty of the different stages of the HDITA authoring process and if novice technical writers can author effective topic-based technical content in HTML5 (HDITA) without full knowledge of XML (DITA). Method: To evaluate the feasibility of authoring and publishing with HDITA, we modified the Instructions assignment of an introductory college course called Technical Writing. Students wrote blog posts during the authoring process and completed a survey on the perceived difficulty of HDITA. We evaluated the quality of HDITA Web deliverables with college students from diverse technical and academic backgrounds. Results: Most author students were somewhat confident authoring technical content with HDITA, and most said they were very likely to somewhat likely to use HDITA in the future for technical writing projects. Students reported that the most difficult part of using HDITA involved Web templates and not HDITA itself. Twenty-seven students evaluated HDITA deliverables and gave them positive scores using a rubric for assessing quality technical information. Conclusion: Acknowledging the small number of student authors involved in this feasibility study, we can still conclude that novice technical writers did not perceive creating technical documentation with HDITA as difficult or highly complex. Most student evaluators were able to complete the assigned tasks following the instructions created in HDITA.",,,,,,,,,,,34,4,4,,,,,,,,,,,FEB,2016,63,1,,,,,23,37,,,,,,,,,,,,,,,,,View Full Record in Web of Science
J,"Dubinsky, JM","Dubinsky, James M.",,,Products and Processes: Transition from Product Documentation to ... Integrated Technical Content,TECHNICAL COMMUNICATION,,,,Article,,,,,,,,"Purpose: To examine the attitudes and perspectives of individuals in successful companies who manage technical communicators with a specific focus on the products and processes that make up the bulk of their work. Method: This study used a modified Delphi method. To gather data, we used two sets of survey questions and two structured interviews. Results: This research helped to further explain the relationship between what technical communicators produce and how these products function in situating or framing their producers in relation to other subfields/related disciplines, such as UX design, information design, knowledge management, usability, and information architecture. Conclusion: While there is general agreement among the managers that the role of the technical communicator has to expand, there is no one clear agreed-upon strategy. Some companies are obtaining success using Agile methodology, while others are finding that this methodology, while stressing adaptability, is not easy to introduce. Corporate cultures do not change overnight. Still, integrated teams, a key component of Agile, are taking hold in most cultures. Equally important, the shift away from writing documents to directing content is well underway. The key now, as it has been for decades, is for technical communicators to highlight their value and make their contributions more visible.",,,,,,,,,,,38,19,19,,,,,,,,,,,MAY,2015,62,2,,,,,118,134,,,,,,,,,,,,,,,,,View Full Record in Web of Science
J,"Meloncon, L","Meloncon, Lisa",,,Current Overview of Academic Certificates in Technical and Professional Communication in the United States,TECHNICAL COMMUNICATION,,,,Article,,,,,,,,"Purpose: This paper provides a current overview of graduate and undergraduate academic certificates in the U. S. It details information about the current number of certificates, requirements, and courses, both required and elective. Method: The study employed qualitative inquiry methods based primarily on textual analysis and the deployment of codes to assign a summative attribute for course types. Results: The field presently offers 110 certificates, which represents a growth rate of 186% for graduate certificates and a growth rate of 191% for undergraduate certificates. Conclusion: Certificate curricular data show that, unlike other degree programs, there is still no consensus on what a certificate should be and what courses should be required. Questions are offered to help the field start conversations about certificates.",,,,,,,,,,,36,11,11,,,,,,,,,,,AUG,2012,59,3,,,,,207,222,,,,,,,,,,,,,,,,,View Full Record in Web of Science
J,"Carliner, S","Carliner, Saul",,,The Three Approaches to Professionalization in Technical Communication,TECHNICAL COMMUNICATION,,,,Article,,,,,,,,"Purpose: Explores internal divisions within our profession by exploring one particular type of tension: that technical communicators do not have a unified view of professionalization for the field. Method: Proposes that prevailing approaches to professionalization are rooted in theories of occupations, the exclusive right to perform a job. True occupations have such rights legally; aspiring occupations like ours are disciplines. Common components of an infrastructure for occupations include professional organizations, bodies of knowledge, education, professional activities, and certification. Results: Disciplines often establish these in anticipation of becoming an occupation, but some practicing professionals interpret and use them differently, resulting in a spectrum of approaches to professionalization. At one end of the spectrum is formal professionalism, which views professionalization as a stepping stone to full occupational status. It is rooted in a worldview that values expertise and sees the infrastructure of an occupation supporting the development of expertise and controlling access to the profession. In the center of the spectrum is quasiprofessionalization, in which individuals participate in the activities of the occupational infrastructure but without the expectation of exclusive rights to perform the work. Quasiprofessionalization is rooted in professional identity. At the other end of the spectrum is contraprofessionalization, which refers to initiatives that offer or promote professional services outside of parts of or the entire infrastructure, sometimes circumventing it completely. This world view is rooted in market theory and characterized by concepts like do-it-yourself (DIY), user-generated, and subject matter expert (SME)-provided documentation. Conclusions: The differing views suggest tensions regarding support for specific efforts to professionalize technical communication, including formal branding of the profession, establishment of certification, and support for professional organizations.",,,,,,,,,,,45,17,17,,,,,,,,,,,FEB,2012,59,1,,,,,49,65,,,,,,,,,,,,,,,,,View Full Record in Web of Science
