J,"Mesibov, M","Mesibov, Marli",,,Defining Content Strategy as a Practice for Engagement,TECHNICAL COMMUNICATION,,,,Article,,,,,,,,"Purpose: This article presents a methodology for using content strategy to promote behavior change in digital interventions. The concept of incorporating motivational theories for achieving health outcomes has been accepted as a valuable element across industries including public health, mental and physical healthcare, financial wellbeing, and education. The author will demonstrate how integrating principles from Self-Determination Theory-a leading theory of human motivation-with content strategy practices can successfully engage and motivate people across digital self-service platforms, focusing specifically on health care. Method: At Mad*Pow, the design team, content strategy team, and behavior change team have implemented content strategy practices in digital interventions via websites and applications. The creation of a content strategy guides the communication frequency, delivery style, information, and channels/touchpoints in order to best achieve the same goals that behavioral science does in face-to-face interventions. The intervention is then built, tested, and launched, after which the team tracks success metrics. Results: The Mad*Pow team has since measured results from clients and consumers, and can show how behavior change methodologies-as implemented using a strong content strategy-positively impact outcomes. Conclusion: Target audiences can be effectively engaged through content strategy in a manner beyond what is available via print, digital design, or other methods.",,,,,,,,,,,30,0,0,,,,,,,,,,,MAY,2019,66,2,,,,,137,146,,,,,,,,,,,,,,,,,View Full Record in Web of Science
J,"Lang, SS; Palmer, L","Lang, Susan; Palmer, Laura",,,Reconceiving Technical Editing Competencies for the 21st Century: Reconciling Employer Needs with Curricular Mandates,TECHNICAL COMMUNICATION,,,,Article,,,,,,,,"Purpose: Current technical editing courses aren't meeting the needs of industry. This manuscript provides readers with a survey of recent editing-related job requirements, gives a brief assessment of popular technical editing textbooks, and describes two iterations of an editing course redesign in which the authors gave students a broader exposure to editing than text and markup. Method: The authors examined the job postings in conjunction with course descriptions, popular technical editing textbooks, and other media to gauge how well undergraduate classes were helping students gain necessary competencies for entering the workforce. Following, the authors redeveloped the curriculum for a 4000-level technical editing class. The curriculum reduced the focus on text editing and markup; instead, it framed the diversity of the profession to students through working with editing manuals/standards, MS Word and Adobe Acrobat, and audio, video, and websites. At semester's end, students were asked to provide feedback on course and content. Results: The revisions to the course disrupted student notions of pencils, paper, and grammar as the backbone of editing. Students were surprised by the new media focus but found it to be very useful. Most had little idea about the breadth of technical editing and enjoyed the exposure to multimodal editing. Most students, however, wanted more work with language basics. Conclusion: Editing jobs are morphing and students need practice in new media environments. Students are able to consider editing competencies as extending beyond text and traditional markup. Yet, most still feel uncomfortable with their own expertise in those areas. Programs should develop more than one editing class: a basic class for language, tools, and technologies, and an advanced class focusing on specific editing topics, such as video, audio, images, and Web.",,,,,,,,,,,18,4,4,,,,,,,,,,,NOV,2017,64,4,,,,,297,309,,,,,,,,,,,,,,,,,View Full Record in Web of Science
J,"Newmark, J; Ford, JD","Newmark, Julianne; Ford, Julie Dyke",,,"An Academic Ejournal As Technical Communication Client Project: Enculturation, Production, and Assessment",TECHNICAL COMMUNICATION,,,,Article,,,,,,,,"Purpose: This article focuses on the integration of a specific client project, the production of an issue of an established ejournal, into the Technical Communication major at New Mexico Tech. Students experienced a workplace context within their university classroom (replete with timeline challenges, requisite managerial decisions, and assignment delegation). Methods: Students' performance on required course documentation and ability to satisfactorily complete course goals were examined, and exit interviews were conducted and analyzed through the lens of theoretical frameworks offered by Cook (2002) and Blakeslee (2001) and correlated to previous research. Results: Students in the course described developed new literacies (per Cook) and participated in a process of gradual exposure, experiencing exposure, authenticity, transition, and response as Blakeslee (2001) stresses, to professional, workplace communication genres. Conclusions: This client project can serve as one model for the kind of bridge for which Blakeslee et al. have called. A critical part of any bridge is its two destinations, so our study points to both footings of such a structure-academic learning modules and workplace practices-both of which must be further explored by technical communication faculty and the technical communication professionals with whom they collaborate and with whom they confer about university program efficacy.",,,,,,,,,,,16,1,1,,,,,,,,,,,NOV,2012,59,4,,,,,286,301,,,,,,,,,,,,,,,,,View Full Record in Web of Science
J,"Killoran, JB","Killoran, John B.",,,Writing for Robots: Search Engine Optimization of Technical Communication Business Web Sites,TECHNICAL COMMUNICATION,,,,Article,,,,,,,,"Purpose: This article explores how businesses offering technical communication services used search engine optimization techniques to attract prospective clients to their business Web sites. Method: The study draws on a survey of 240 principals of these businesses, brief interviews with half of them, analyses of their sites, and tallies of inbound links to their sites. Results: The interviews and analyses reveal how businesses oriented their sites not only to a human audience of prospective clients but also to an audience of search engines. Businesses that reported search engines to be more helpful in directing traffic to their sites had sites that, in comparison with those of their less successful peers, featured longer home page titles and received more inbound links. Conclusion: Though search engine optimization techniques can increase Web site traffic, technical communication businesses varied widely in how extensively and expertly they used such techniques.",,,,,,,,,,,46,10,10,,,,,,,,,,,MAY,2010,57,2,,,,,161,181,,,,,,,,,,,,,,,,,View Full Record in Web of Science
J,"van Velsen, L; van der Geest, T; Steehouder, M","van Velsen, Lex; van der Geest, Thea; Steehouder, Michael",,,The Contribution of Technical Communicators to the User-Centered Design Process of Personalized Systems,TECHNICAL COMMUNICATION,,,,Article,,,,,,,,"Purpose: This article discusses how personalization will affect technical communication practitioners' everyday work, and indicates to researchers which knowledge gaps scientific research needs to fill. Method: After a description of how personalization exactly works, we demonstrate that the technique is very similar to the approach to personalization as applied in ancient rhetoric. Next, we describe how the history of the concept the audience, and how it has been analyzed and approached, has led to the tactic of electronically tailoring communication to individuals. We propose the User-Centered Design approach as an approach that can help the designer get to know the individual user, thereby increasing the fit between personalized systems and users' needs, wishes, and contexts. Results: We discuss how the User-Centered Design approach needs to be adjusted to cope with the demands personalization places on the approach. Furthermore, we consider the technical communicator's role in this design process. Conclusion: Technical communicators need to devise and lead user studies that inform and evaluate each step of the personalization process. Researchers need to focus their efforts on studies that aid the design of personalized systems, like discerning in which situations personalization is of added value or not, and identifying the factors that influence the acceptance of personalization.",,,,,,,,,,,48,2,2,,,,,,,,,,,MAY,2010,57,2,,,,,182,196,,,,,,,,,,,,,,,,,View Full Record in Web of Science
J,"Chisnell, DE; Redish, JC; Lee, A","Chisnell, DE; Redish, JC; Lee, A",,,New heuristics for understanding older adults as web users,TECHNICAL COMMUNICATION,,,,Article,,,,,,,,"Presents a new set of 20 heuristics for evaluating Web sites for older adults users Presents a new, more richly nuanced model of older adults as Web users and a new methodology of persona-based, task-based heuristic review.",,,,,,,,,,,26,32,32,,,,,,,,,,,FEB,2006,53,1,,,,,39,59,,,,,,,,,,,,,,,,,View Full Record in Web of Science
J,"Kim, L","Kim, L",,,Tracing visual narratives: User-testing methodology for developing a multimedia museum show,TECHNICAL COMMUNICATION,,,,Article,,,,,,,,Reports on the use of visual narrative for user-testing an interactive museum show Demonstrates that mapping the audience's reading of the visual narratives was an effective testing structure in developing the show.,,,,,,,,,,,62,8,8,,,,,,,,,,,MAY,2005,52,2,,,,,121,137,,,,,,,,,,,,,,,,,View Full Record in Web of Science
J,"Turns, J; Wagner, T; Shuyler, K","Turns, J; Wagner, T; Shuyler, K",,,Moving toward knowledge-building communities in informational Web site design,TECHNICAL COMMUNICATION,,,,Article,,,,,,,,Describes how a knowledge-building community perspective can lead to a framework for designing an informational site. Provides one means of addressing challenges that arise in the design and development of informational Web sites.,,,,,,,,,,,20,3,3,,,,,,,,,,,FEB,2005,52,1,,,,,52,63,,,,,,,,,,,,,,,,,View Full Record in Web of Science
J,"Meloncon, L; Potts, L","Meloncon, Lisa; Potts, Liza",,,Recursive Participatory Mentoring: A New Model for Mentoring Women in the Technical Communication Workplace,TECHNICAL COMMUNICATION,,,,Article,,,,,,,,"Purpose: Few organizations would question the importance of mentoring, yet mentoring is an under-researched aspect of technical communication. In fact, the vast amount of research across disciplines points to the need for new models for mentoring, particularly for women. This article offers a new mentoring model. Method: A comprehensive review of the literature with a workplace case study provides a foundation for a new mentoring model in technical communication, addressing the limitations of current models. Results: The literature review exposes weaknesses in current models for mentoring women. The recursive participatory mentoring (RPM) model developed in an academic setting shows potential for addressing these weaknesses, as shown through a workplace case study. Conclusion: Technical communication needs new and innovative mentoring models to address the needs of women in the workplace. The recursive participatory mentoring model we describe provides the flexibility to be implemented in diverse workplaces and professional organizations. The model has shown initial success in providing women access to sustainable mentoring through their careers.",,,,,,,,,,,41,0,0,,,,,,,,,,,MAY,2020,67,2,,,,,54,67,,,,,,,,,,,,,,,,,View Full Record in Web of Science
J,"Strimling, Y","Strimling, Yoel",,,Beyond Accuracy: What Documentation Quality Means to Readers,TECHNICAL COMMUNICATION,,,,Article,,,,,,,,"Purpose: The purpose of this paper is to propose a preliminary, focused, clearly defined, and reader-oriented model for collecting meaningful and actionable feedback to improve documentation quality and increase reader satisfaction. This model is based on a narrow yet comprehensive set of 15 distinct information quality dimensions (based on previous research by Wang and Strong, 1996) that cover all categories of information quality - Intrinsic, Contextual, Representational, and Accessibility (ICRA). Research was done to determine which information quality dimensions readers rated as most important per category (as they related to documentation), which were then used to create a clear, comprehensive, and empirically based definition of documentation quality from the readers' point of view. This definition of documentation quality is the heart of the model and provides a strong basis for measuring what readers want from the documentation we send them. Methods: Questionnaires were sent to readers, asking them to rate Wang & Strong's information quality dimensions in terms of importance as they applied to documentation. Dimensions were sorted by information quality category, and the most important dimension per category (as determined by weighted average) was calculated. Results: According to readers, the following four information quality dimensions are the most important per ICRA category for documentation: Accurate, Relevant, Easy to Understand, and Accessible (AREA). Conclusions: We can use the AREA information quality dimensions to create a preliminary, focused, clearly defined, and reader-oriented model for collecting meaningful and actionable feedback that will improve documentation quality and increase reader satisfaction.",,,,,,,,,,,64,2,2,,,,,,,,,,,FEB,2019,66,1,,,,,7,29,,,,,,,,,,,,,,,,,View Full Record in Web of Science
J,"Ballentine, B","Ballentine, Brian",,,Using Process Modeling Notation to Map the Buying and Selling of Complex Software Solutions: A Qualitative Study's Implications for Practice and Pedagogy,TECHNICAL COMMUNICATION,,,,Article,,,,,,,,"Purpose: To demonstrate the importance of standardized process modeling notation and its value to technical communicators involved with visualizing business or technical processes. To argue that a standardized process modeling notation can assist with bridging cultural communication gaps brought on by globalized workplaces. Method: A rhetorical analysis emphasizing how effectively technical communication visualizations address audience, purpose, and documentation conventions. Communication visualizations were modeled first using nonstandard and then standardized modeling techniques. The visualizations were generated as part of a qualitative study to represent the business and communication processes of a senior level employee from a software firm. Results: Nonstandard or proprietary data models and visualizations are not readily useful to diverse audiences, especially global audiences. Models should be developed with notation software that supports open standards. Conclusion: Technical communicators should become proficient with process modeling notation and understand the fundamentals of standardized notations such as Uniform Modeling Language (UML) and Business Process Modeling Notation (BPMN). Academics teaching and researching technical communication should be wary of creating a divide between industry and the academy by perpetuating the use of non-standard models.",,,,,,,,,,,66,0,0,,,,,,,,,,,AUG,2016,63,3,,,,,212,230,,,,,,,,,,,,,,,,,View Full Record in Web of Science
J,"Kister, TM","Kister, Tina M.",,,Improving the Information Development Process: A Refined Iterative Development Model,TECHNICAL COMMUNICATION,,,,Article,,,,,,,,"Purpose: This article presents a refined iterative development model that may be used to improve the processes related to information development. Specifically, the model is designed to facilitate rapid and incremental delivery and increased quality and efficiency. Method: The refined iterative development model is based on an analysis of models from across a range of industries. The analysis was designed to clearly define what a development model is, the basic phases it contains, and various common uses. The approach to this project was from the perspective of a practicing technical communication professional and project manager. Results: The analysis revealed that development models are visual, conceptual, representational, process-oriented, inventive, and both sequential and iterative. The basic phases common to development models are, generally speaking, Discovery, Planning, Implementation, Review, Refinement, and Release (or Deployment). Common uses include sharing knowledge, facilitating success, enhancing credibility, and demonstrating progress. Conclusion: The analysis and comparison allows for a deeper understanding of what a development model is and how a refined iterative development model can be used to improve processes related to information development.",,,,,,,,,,,52,2,2,,,,,,,,,,,AUG,2016,63,3,,,,,186,211,,,,,,,,,,,,,,,,,View Full Record in Web of Science
J,"Kimball, MA","Kimball, Miles A.",,,Special Issue Introduction Technical Communication: How A Few Great Companies Get It Done,TECHNICAL COMMUNICATION,,,,Article,,,,,,,,"Purpose: This article introduces a special issue assessing the attitudes, ideas, and practices of technical communication managers representing several prominent companies on the Society for Technical Communication's Advisory Council in 2013-2014. Method: The research team used a modified Delphi method to assess the opinions of this group of experts over several rounds. This article describes and justifies the methodological approach of the entire study. Results: The results are described in three individual articles following this introduction in the special issue, taking up the topics respectively of Identities and Relationships, Products and Processes, and Training and Education. Conclusion: Technical communication should pay more attention to the perspective of publications managers.",,,,,,,,,,,21,7,7,,,,,,,,,,,MAY,2015,62,2,,,,,88,103,,,,,,,,,,,,,,,,,View Full Record in Web of Science
J,"Cornelissen, PA; van Hoof, JJ; van Vuuren, M","Cornelissen, Pieter A.; van Hoof, Joris J.; van Vuuren, Mark",,,Enabling Employees to Work Safely: The Influence of Motivation and Ability in the Design of Safety Instructions,TECHNICAL COMMUNICATION,,,,Article,,,,,,,,"Purpose: One of the major challenges for modern organizations is to create healthy and safe work environments, as evidenced by the number of occupational deaths (worldwide: four per minute), and an even higher number of injuries. This study explores different levels of motivation and ability, to identify which are most relevant for safety climate and safety performance. This study aims to pinpoint the areas information designers should focus on to most effectively contribute to healthy and safe work environments. Method: We designed a questionnaire for employees of a Dutch high-tech and high-risk warehouse, a workplace where safety regulations are important. The employees scored their attitudes regarding motivation, ability, safety climate, and safety performance. Results: The results confirmed the expected relationship between safety climate and safety performance. Of the explored sublevels of motivation and ability, personal motivation and external ability proved most relevant for creating a healthy safety climate and healthy safety performance. Conclusion: In the design of safety instructions, focusing on personal motivation and external ability seems a promising strategy for contributing to healthy and safe work environments, especially in high-risk environments.",,,,,,,,,,,61,5,5,,,,,,,,,,,NOV,2014,61,4,,,,,232,244,,,,,,,,,,,,,,,,,View Full Record in Web of Science
J,"Kline, J; Alex-Brown, K","Kline, Joel; Alex-Brown, Konstanze",,,The Social Body of Knowledge: Nurturing Organizational Social Capital via Social Media Based Communities of Practice,TECHNICAL COMMUNICATION,,,,Article,,,,,,,,"Purpose: To develop a theoretical model that layers community structure on top of employee social media engagement to improve social capital. This improved social capital leads to tacit knowledge sharing. Method: The proposed theoretical model is grounded in previously published research on organizational social capital and communities of practice, relevant literature, and survey research. The authors examine aspects of their previous research in social media and communities to build a theoretical model. Results: The theoretical model shows the congruent outcomes that occur when using social media to establish communities of practice to address the problem of sharing tacit knowledge within an organization. Conclusions: Communities of practice can form an important bridge between social media technology and people within an organization. Technical communicators can layer communities of practice on the top of social media for an effective strategy to develop increased social capital to support innovation, communication, and body of knowledge efforts.",,,,,,,,,,,45,10,11,,,,,,,,,,,NOV,2013,60,4,,,,,279,292,,,,,,,,,,,,,,,,,View Full Record in Web of Science
J,"Beldad, A; Steehouder, M","Beldad, Ardion; Steehouder, Michael",,,Not That Button but the Other: Misunderstanding and Non-understanding in Helpdesk Encounters Involving Nonnative English Speakers,TECHNICAL COMMUNICATION,,,,Article,,,,,,,,"Purpose: The internationalization of technical help over the phone is tied to the increasing usage of a lingua franca facilitating the interaction between a call center agent and a caller who are both linguistically different. Researchers have noted that interactions between two parties who are nonnative users of the language employed for the encounter are peppered with understanding problems. This study looks into the causes of understanding problems in helpdesk encounters between nonnative speakers of English and the techniques those interacting parties used to resolve or prevent flaws in the conversation. Method: Conversation analysis was used to analyze 25 recorded phone calls, amounting to 750 minutes of data, made in a commercial call center and in the helpdesk of an international academic institute in Enschede, the Netherlands. Results: Analysis of the phone calls reveals that causes of understanding problems between an agent and a caller who are nonnative users of English go beyond asymmetries in their proficiency with the language. Factors such as incomplete information or erroneous inference from the utterance of the partner in the interaction are important triggers for the occurrence of understanding problems. Consequently, call center agents and callers use varied repair and preventative techniques to ensure that understanding problems will not impede the attainment of the primary goal of the encounter-to resolve the product-related problem of the caller. Conclusion: While understanding problems are inevitable in helpdesk encounters, especially those that involved nonnative users of the language employed for the interaction, such problems are hardly attributable to the linguistic differences characterizing interacting parties. It is apparent that helpdesk agents and callers are equipped with varied techniques to resolve understanding problems or to prevent their inception.",,,,,,,,,,,49,1,1,,,,,,,,,,,AUG,2012,59,3,,,,,179,194,,,,,,,,,,,,,,,,,View Full Record in Web of Science
J,"Coppola, NW","Coppola, Nancy W.",,,The Technical Communication Body of Knowledge Initiative: An Academic-Practitioner Partnership,TECHNICAL COMMUNICATION,,,,Article,,,,,,,,"Purpose: This article chronicles the STC Technical Communication Body of Knowledge process from 2007 to 2009 and provides key elements of a landmark project to develop a body of disciplinary knowledge. Method: The author, who is a member of the Body of Knowledge Task Force, documents the chronology of the project through firsthand accounts. A brief review of literature helps to place this initiative within the context of technical communication professionalization and identifies its uniqueness from previous efforts. Results: The project demonstrates a productive partnership between practitioners and academics. It promises to help technical communicators assess their own level of knowledge and skills, provide easily accessible information for those wanting to hire technical communicators or enter the profession, and define the profession as a specialized set of skills, abilities, and knowledge. Conclusion: This project laid the groundwork for a body of knowledge that has the potential to establish technical communication as a true profession.",,,,,,,,,,,38,18,18,,,,,,,,,,,FEB,2010,57,1,,,,,11,25,,,,,,,,,,,,,,,,,View Full Record in Web of Science
J,"Wilde, E; Corbin, M; Jenkins, J; Rouiller, S","Wilde, Elizabeth; Corbin, Michelle; Jenkins, Jana; Rouiller, Shannon",,,Defining a quality system: Nine characteristics of quality and the editing for quality process,TECHNICAL COMMUNICATION,,,,Article,,,,,,,,Describes a standard editing process that produces a measurement of information quality Defines nine characteristics of quality information in three categories.,,,,,,,,,,,20,3,3,,,,,,,,,,,NOV,2006,53,4,,,,,439,446,,,,,,,,,,,,,,,,,View Full Record in Web of Science
J,"Doumont, JL","Doumont, JL",,,The cognitive style of PowerPoint: Slides are not all evil,TECHNICAL COMMUNICATION,,,,Article,,,,,,,,"Analyzes Edward Tufte's case against PowerPoint and reveals its shortcomings Establishes that slides can be effective, even if most are not. Proposes commonsense guidelines for more effective slides.",,,,,,,,,,,7,38,38,,,,,,,,,,,FEB,2005,52,1,,,,,64,70,,,,,,,,,,,,,,,,,View Full Record in Web of Science
